{
  "specVersion": "0.2.0",
  "id": "b2c3d4e5-f6a7-8901-bcde-f12345678901",
  "startTime": "2026-03-30T09:15:00Z",
  "endTime": "2026-03-30T09:38:00Z",
  "status": "completed",
  "agent": {
    "name": "Claude Code",
    "version": null,
    "model": "claude-sonnet-4-6",
    "provider": "anthropic",
    "properties": {}
  },
  "project": {
    "name": "api-server",
    "repository": "acme/api-server",
    "workingDirectory": "/home/dev/api-server",
    "branch": "main",
    "commitSha": "f7e8d9c",
    "properties": {}
  },
  "developer": {
    "id": "dev-2",
    "name": "Alex Chen",
    "properties": {}
  },
  "events": [
    {
      "type": "message",
      "id": "evt-0",
      "timestamp": "2026-03-30T09:15:00Z",
      "parentId": null,
      "durationMs": null,
      "role": "user",
      "content": "Users are getting 500 errors on the /api/payments endpoint. Sentry shows TypeError: Cannot read properties of undefined (reading 'amount'). Can you debug this?",
      "tokenUsage": null,
      "properties": {}
    },
    {
      "type": "search",
      "id": "evt-1",
      "timestamp": "2026-03-30T09:15:08Z",
      "parentId": null,
      "durationMs": 85,
      "tool": "Grep",
      "query": "amount.*payment|payment.*amount",
      "resultCount": 7,
      "topResults": [
        "src/routes/payments.ts:42",
        "src/routes/payments.ts:67",
        "src/services/stripe.ts:28"
      ],
      "properties": {}
    },
    {
      "type": "fileOperation",
      "id": "evt-2",
      "timestamp": "2026-03-30T09:15:15Z",
      "parentId": null,
      "durationMs": null,
      "operation": "read",
      "path": "src/routes/payments.ts",
      "diff": null,
      "beforeHash": null,
      "afterHash": null,
      "linesAdded": null,
      "linesRemoved": null,
      "properties": {}
    },
    {
      "type": "reasoning",
      "id": "evt-3",
      "timestamp": "2026-03-30T09:15:30Z",
      "parentId": null,
      "durationMs": null,
      "intent": "Identify why payment.amount is undefined",
      "alternatives": [
        "The request body might be missing the amount field",
        "The Stripe webhook payload format might have changed",
        "The database query might be returning null for the payment record"
      ],
      "rationale": "The error occurs at line 42 where payment.amount is accessed. The payment object comes from a database query on line 38 using req.params.id. If the payment ID doesn't exist, the query returns null, and accessing .amount on null throws.",
      "properties": {}
    },
    {
      "type": "message",
      "id": "evt-4",
      "timestamp": "2026-03-30T09:16:00Z",
      "parentId": null,
      "durationMs": null,
      "role": "assistant",
      "content": "Found the bug. On line 42 of payments.ts, `payment.amount` is accessed without checking if the payment record exists. The database query on line 38 can return null when the payment ID is invalid, but there's no null check before accessing properties.",
      "tokenUsage": {
        "inputTokens": 3200,
        "outputTokens": 450,
        "cacheReadTokens": 2100,
        "cacheWriteTokens": null
      },
      "properties": {}
    },
    {
      "type": "fileOperation",
      "id": "evt-5",
      "timestamp": "2026-03-30T09:16:30Z",
      "parentId": "evt-4",
      "durationMs": null,
      "operation": "edit",
      "path": "src/routes/payments.ts",
      "diff": "--- a/src/routes/payments.ts\n+++ b/src/routes/payments.ts\n@@ -38,6 +38,10 @@\n   const payment = await db.payments.findById(req.params.id);\n+  if (payment === null) {\n+    return res.status(404).json({ error: 'Payment not found' });\n+  }\n   const amount = payment.amount;",
      "beforeHash": "abc123",
      "afterHash": "def456",
      "linesAdded": 3,
      "linesRemoved": 0,
      "properties": {}
    },
    {
      "type": "terminalCommand",
      "id": "evt-6",
      "timestamp": "2026-03-30T09:17:00Z",
      "parentId": "evt-4",
      "durationMs": 4500,
      "command": "npm test -- --grep payments",
      "cwd": "/home/dev/api-server",
      "stdout": "PASS src/routes/payments.test.ts\n  payments endpoint\n    ✓ returns 404 for invalid payment ID (12ms)\n    ✓ processes valid payment (45ms)\n\n2 passed, 0 failed",
      "stderr": null,
      "exitCode": 0,
      "properties": {}
    },
    {
      "type": "error",
      "id": "evt-7",
      "timestamp": "2026-03-30T09:15:00Z",
      "parentId": null,
      "durationMs": null,
      "message": "TypeError: Cannot read properties of undefined (reading 'amount')",
      "code": "TypeError",
      "recovery": "fixed",
      "resolved": true,
      "properties": {
        "sentry_issue_id": "PAYMENTS-42",
        "affected_users": 23,
        "stack_trace": "at processPayment (src/routes/payments.ts:42:30)"
      }
    }
  ],
  "metrics": {
    "messageCount": 2,
    "toolCallCount": 5,
    "filesTouchedCount": 1,
    "durationMinutes": 23,
    "tokenUsage": {
      "inputTokens": 3200,
      "outputTokens": 450,
      "cacheReadTokens": 2100,
      "cacheWriteTokens": null
    },
    "estimatedCostUsd": 0.008,
    "filesTouched": ["src/routes/payments.ts"],
    "toolsUsed": ["Grep", "Read", "Edit", "Bash"],
    "properties": {}
  },
  "relationships": {
    "commits": [
      {
        "sha": "a1b2c3d",
        "message": "fix: add null check for payment lookup to prevent 500 errors",
        "repository": "acme/api-server",
        "timestamp": "2026-03-30T09:18:00Z"
      }
    ],
    "pullRequests": [],
    "issues": [],
    "errors": [
      {
        "id": "PAYMENTS-42",
        "source": "sentry",
        "url": "https://sentry.io/issues/PAYMENTS-42",
        "title": "TypeError: Cannot read properties of undefined (reading 'amount')"
      }
    ],
    "deployments": [],
    "parentSession": null,
    "childSessions": [],
    "properties": {}
  },
  "properties": {}
}
